step_id,description,imageUrl,recipe_id
3,"Параллельно надо разогреть куриный бульон и развести в нем щепотку шафрана. Этим самым бульоном залить рис с овощами и курицей, посолить, поперчить и бросить туда же несколько горошин черного перца и варить ­десять минут на небольшом огне. Бульон может выкипать интенсивнее, чем вы планировали, его недостаток можно восполнять дополнительными инъекциями куриного бульона, воды или белым сухим вином.",https://s1.eda.ru/StaticContent/Photos/170210144850/170306161524/p_O.jpg,17276
4,"Дальше в рис нужно добавить горошек, перемешать, выложить сверху креветки, полить лимонным соком, посыпать рубленой петрушкой и за три-четыре минуты довести паэлью до готовности на том же медленном огне, накрыв крышкой.",https://s1.eda.ru/StaticContent/Photos/170210144850/170306161525/p_O.jpg,17276
5,Подавать с розовым каталонским или валенсийским вином. Очень холодным.,,17276
1,"Муку смешать с солью, влить четверть стакана теплой воды и перемешать. Влить оставшуюся воду, постоянно помешивая. Замесить крутое тесто.",https://s1.eda.ru/StaticContent/Photos/150506002001/150512183046/p_O.png,50481
2,Измельчить зелень и перемешать со 100 граммами растопленного масла.,https://s1.eda.ru/StaticContent/Photos/150506002001/150512183047/p_O.png,50481
3,"Тесто разделить на четыре равные части, каждую из которых раскатать в тонкий блин — толщиной около 1 миллиметра.",https://s1.eda.ru/StaticContent/Photos/150506002001/150512183048/p_O.png,50481
4,"Выложить начинку на половину раскатанного теста, накрыть второй половиной и запечатать края с помощью вилки. Важно добиться того, чтобы внутри осталось как можно меньше воздуха.",https://s1.eda.ru/StaticContent/Photos/150506002001/150512183049/p_O.png,50481
5,"Выложить кутабы на разогретую сухую сковороду, обжаривать по 2–3 минуты с каждой стороны на медленном огне. Смазать готовые кутабы сливочным маслом.",https://s1.eda.ru/StaticContent/Photos/150506002001/150512183051/p_O.png,50481
1,"Мелко нарезать лук, помидоры и болгарский перец, добавить кукурузу (по желанию), обжарить все на небольшом количестве масла, переложить в миску, по желанию, можно добавить мелконарезанный укроп (для свежести).",https://s1.eda.ru/StaticContent/Photos/170225172301/200120100259/p_O.png,39152
2,"Куриное филе нарезать тонкими брусочками (не более 1 см толщиной) и обжарить в оливковом масле на сильном огне в течение 2–3 минут, помешивая. Добавить томатную пасту, соль и перец, перемешать, подержать на огне еще 1 минуту и переложить мясо к овощам.",https://s1.eda.ru/StaticContent/Photos/170225172301/200120100300/p_O.png,39152
3,"Сыр чеддер натереть на крупной терке (также это может быть пармезан, гауда или другой твердый/полутвердый сыр).",https://s1.eda.ru/StaticContent/Photos/170225172301/200120100301/p_O.png,39152
4,"В тортилью на половину посыпать сыр, затем выложить начинку, сверху — еще слой сыра, накрыть второй половиной тортильи, разрезать пополам (как на картинке) и обжарить на сковороде или гриле в течение 2–3 минут  одной стороны, затем аккуратно перевернуть и поджарить с другой стороны еще 1–2 минуты.",https://s1.eda.ru/StaticContent/Photos/170225172301/200120100302/p_O.png,39152
1,"Свежее манго очистить от кожи, вырезать косточку, а мякоть нарезать небольшими кубиками. На тарелки выложить по две-три горсти свежих салатных листьев, а сверху на них — кубики манго.",https://s1.eda.ru/StaticContent/Photos/140124100744/140131130011/p_O.jpg,23847
2,"Приготовить заправку. Для этого взбить в небольшой миске вилкой дижонскую горчицу, потихоньку вливая оливковое масло. Добавить к этой смеси мед и следом обычную острую горчицу. Хорошо размешать.",https://s1.eda.ru/StaticContent/Photos/140124100744/140131130012/p_O.jpg,23847
3,На небольшой сковороде разогреть растительное масло и быстро обжарить на нем кусочки куриной печени со всех сторон до появления яркой румяной корочки. Посолить и поперчить по вкусу.,https://s1.eda.ru/StaticContent/Photos/140124100744/140131130013/p_O.jpg,23847
4,Готовые кусочки печени аккуратно разложить по тарелкам и щедро полить салат сверху горчично-медовые заправкой — по семь-восемь столовых ложек соуса на порцию.,https://s1.eda.ru/StaticContent/Photos/140124100744/140131130014/p_O.jpg,23847
5,"Подавать салат сразу, пока куриная печень не остыла, а зеленые листья не сникли. При желании каждую порцию салата можно дополнительно посыпать свежемолотым черным перцем.",https://s1.eda.ru/StaticContent/Photos/140124100744/1401311300140/p_O.jpg,23847
1,Срежьте кочерыжку и старые листья с капусты. Тонко нашинкуйте и переложите в большую миску. ,https://s1.eda.ru/StaticContent/Photos/110811170903/170314171856/p_O.png,19416
2,"На терке натрите морковь и редьку и смешайте с капустой. Добавьте мелко нарезанный перец, зеленый лук и петрушку.",https://s1.eda.ru/StaticContent/Photos/110811170903/1703141718560/p_O.png,19416
3,"Перед подачей заправьте майонезом, посыпьте солью и хорошо перемешайте.",https://s1.eda.ru/StaticContent/Photos/110811170903/170314171857/p_O.png,19416
1,Картошку очистить и нарезать тонкими круглыми ломтиками.,https://s1.eda.ru/StaticContent/Photos/151124224236/151203165737/p_O.jpg,16911
2,"Лук нарезать полукольцами и в глубокой сковороде на смеси растительного и сливочного масла обжарить до мягкости, потом добавить в ту же сковороду картошку и жарить овощи до тех пор, пока картошка не станет мягкой, но еще до конца не приготовится.",https://s1.eda.ru/StaticContent/Photos/151124224236/151203165739/p_O.jpg,16911
3,"В глубокой миске взбить яйца с солью и перцем. Пересыпать из сковороды в миску полуготовую картошку с луком и перемешать овощи с яйцами и, предварительно нарезанной кинзой.",https://s1.eda.ru/StaticContent/Photos/151124224236/151203165740/p_O.jpg,16911
4,"Вывалить содержимое миски обратно в сковороду и поставить ее на плиту на пять минут. За это время разогреть духовку до 180 градусов и переместить сковороду туда. Дать тортилье три-четыре минуты, чтобы подрумянилась.",https://s1.eda.ru/StaticContent/Photos/151124224236/151203165741/p_O.jpg,16911
5,"Достать из духовки, нарезать ломтями и подавать с белым хлебом, смазанным оливковым маслом и давленым чесноком.",https://s1.eda.ru/StaticContent/Photos/151124224236/151203165743/p_O.jpg,16911
1,"Нарезать мелко луковицу, четыре зубчика чеснока и один острый перец чили. На оливковом масле обжарить лук, чеснок и чили. Можно кинуть щепотку сахара, чтобы карамелизовать овощи и дать сладкую оттяжку помидорам, которые появятся впоследствии в соусе. Добавить шепотку орегано, чуть-чуть кумина и жарить лук с чесноком и перцем до тех пор, пока они не начнут плакать или, как говорят французы,— потеть. Зажаривать сильно не нужно, давать карамельного цвета — тоже.",https://s1.eda.ru/StaticContent/Photos/160608133558/160616142633/p_O.jpg,69608
2,"Теперь надо вывалить банку протертых консервированных помидоров и обжаривать их вместе с луком и прочим, помешивая, примерно минуту. Долить воды или томатного соуса, чтобы сделать соус достаточно жидким и тушить минуту-другую. ",https://s1.eda.ru/StaticContent/Photos/160608133558/160616142638/p_O.jpg,69608
3,"Добавить соль, черный или белый молотый перец и петрушку. Аккуратно разбить в соус яйца, так, чтобы они не растеклись, а лежали — каждое в своей лунке. Добавить кусочки феты или другого мягкого солоноватого сыра. Огонь под сковородкой можно убрать до минимума. А потом и вовсе отправить сковородку в духовку на три минуты. Или накрыть крышкой. Яйца должны сохранить достаточно жидкий желток.",https://s1.eda.ru/StaticContent/Photos/160608133558/160616142642/p_O.jpg,69608
4,В конце необходимо посыпать яичницу рубленой петрушкой и кинзой. И подавать с лепешкой питой или белым хлебом. ,https://s1.eda.ru/StaticContent/Photos/160608133558/160616142646/p_O.jpg,69608
5,"В качестве идеального завтрака, обеда и ужина идеально подавать вместе с кофе.",https://s1.eda.ru/StaticContent/Photos/150506002001/160627120128/p_O.jpg,69608
1,Чеснок и лук мелко порезать. Масло растопить. Обжарить лук и чеснок 1-2 минуты.,https://s1.eda.ru/StaticContent/Photos/140321134811/200927220420/p_O.jpg,55603
2,Добавить очищенные креветки. Готовить 2–3 минуты.,https://s1.eda.ru/StaticContent/Photos/140321134811/200925232839/p_O.jpg,55603
3,"Приправить солью и перцем. Влить сливки, довести до кипения.",https://s1.eda.ru/StaticContent/Photos/140321134811/200925232840/p_O.jpg,55603
4,Добавить петрушку и выключить.,https://s1.eda.ru/StaticContent/Photos/140321134811/200925232842/p_O.jpg,55603
5,"Пасту отварить согласно инструкции на упаковке. Смешать с соусом. Подавать в теплом виде.
",https://s1.eda.ru/StaticContent/Photos/140321134811/200925232844/p_O.jpg,55603
1,"Говяжье филе нарезать тонкими ломтиками. Имбирь мелко нарубить, а лук нарезать тонкими полукольцами. Брокколи разобрать на соцветия и отварить в течение трех минут в кипящей воде. Охладить, чтобы соцветия не потеряли зеленый цвет.",https://s1.eda.ru/StaticContent/Photos/110816122017/170315174804/p_O.png,36638
2,Раскалить сковородку вок с растительным маслом и быстро обжарить в ней нарезанное ломтиками мясо до бронзовой корочки.,https://s1.eda.ru/StaticContent/Photos/110816122017/170315174805/p_O.png,36638
3,"Добавить в сковороду лук и имбирь, а через минуту — устричный соус и брокколи. Жарить еще минуту-две, постоянно помешивая. Снять с огня и заправить соком лимона и мелко нарубленной кинзой.",https://s1.eda.ru/StaticContent/Photos/110816122017/1703151748050/p_O.png,36638
1,"Листья шпината промыть, избавить от стеблей, если они слишком грубые, а потом мелко нарезать. Листья петрушки и кинзы обобрать от стеблей и тоже нарезать. Точно так же надо поступить с листьями мяты, зеленый лук можно избавить от белых частей и тоже нарубить. Шпината должно быть примерно втрое больше остальной зелени.",https://s1.eda.ru/StaticContent/Photos/150420184224/150424171808/p_O.jpg,50260
2,"Взять щепотку листьев тимьяна и смешать с йогуртом и слегка взбитыми яйцами. Посолить, поперчить смесь и добавить в нее всю нарезанную зелень.",https://s1.eda.ru/StaticContent/Photos/150420184224/150424171809/p_O.jpg,50260
3,Помидоры черри (опциональный шаг) сбрызнуть оливковым маслом и поставить на 20 минут в духовку.,https://s1.eda.ru/StaticContent/Photos/150420184224/150424171810/p_O.jpg,50260
4,"В глубокой сковородке слегка припустить мелко нарубленный чеснок на топленом сливочном масле. Влить в ту же сковородку смесь яиц, йогурта и зелени и поставить в духовку (180 градусов) примерно на 15–20 минут.",https://s1.eda.ru/StaticContent/Photos/150420184224/150424171811/p_O.jpg,50260
5,"Готовый зеленый омлет кюкю украсить печеными помидорами и подавать. Помидоры, кстати, можно вмешать в смесь зелени еще до запекания, но тогда они нарушат цветовую гегемонию кюкю.",https://s1.eda.ru/StaticContent/Photos/150420184224/150424171812/p_O.jpg,50260
1,"Куриную грудку надрезать вдоль и развернуть как книгу. Посолить поперчить, посыпать острым перцем, сбрызнуть растительным маслом, накрыть пленкой и дать помариноваться 10-15 минут. Обжарить на раскаленной сковороде по 2 минуты с каждой стороны. Затем переложить и дать остыть.",https://s1.eda.ru/StaticContent/Photos/120131082454/170512133928/p_O.jpg,92551
2,"Нарезать красный лук крупными дольками, сладкий перец, чили и помидоры нарезать кусками такого же размера. Чеснок нарезать мелко.",https://s1.eda.ru/StaticContent/Photos/120131082454/170512133929/p_O.jpg,92551
3,"На ту же сковороду добавить масло, и на сильном огне обжарить сначала сладкий перец, затем добавить к нему лук, чили и чеснок. Ближе к концу добавить помидоры. Овощи должны получиться с румяными зажаренными боками, но при этом оставаться хрустящими.",https://s1.eda.ru/StaticContent/Photos/120131082509/170512133929/p_O.jpg,92551
4,"Курицу нарезать крупными кусками, кинзу тоже не очень мелко. Добавить их к обжаренным овощам, посолить, поперчить, добавить сахар и полить соком лайма.",https://s1.eda.ru/StaticContent/Photos/120131082509/1705121339290/p_O.jpg,92551
5,"На сухой сковороде подогреть тортилью с обеих сторон, положить тертый сыр и начинку, сложить пополам и отправить в духовку, разогретую до 200 градусов на режиме гриля. Подпекать тортилью нужно 4-5 минут, тортильи должны стать золотистыми и хрустящими. Подавать со сметаной.",https://s1.eda.ru/StaticContent/Photos/120131082509/170512133930/p_O.jpg,92551
1,Отварить говядину в подсоленной воде. Отдельно сварить картошку и морковь.,https://s1.eda.ru/StaticContent/Photos/120505175012/181206155634/p_O.jpg,54990
2,Нарезать мясо и овощи мелким кубиком. Для красоты и гармонии ингредиенты нужно нарезать кубиками одного размера.,https://s1.eda.ru/StaticContent/Photos/120505175012/181206155636/p_O.jpg,54990
3,"Перемешать все подготовленные ингредиенты силиконовой лопаткой, чтобы не разрушить их форму. ",https://s1.eda.ru/StaticContent/Photos/120505175012/181206155637/p_O.jpg,54990
4,"Добавить майонез, посолить и поперчить по вкусу. Горошек добавить в самом конце, перед подачей, иначе в салате он может потерять форму.  При подаче посыпать мелко нашинкованным зеленым луком. ",https://s1.eda.ru/StaticContent/Photos/120505175012/181206155638/p_O.jpg,54990
1,Тщательно взбить яйца с молоком — лучше обыкновенной вилкой.,,18154
2,"Растопить на сковороде сливочное масло. Сковорода должна быть достаточно разогрета, иначе омлет не получится воздушным.",,18154
3,"Как только масло перестанет пениться, добавить яйца с молоком, покрыв все дно. Нужно немедленно поднять ту часть омлета, которая прихватилась, чтобы яичная смесь под нее затекла. Повторить так несколько раз, слегка покачивая сковороду, чтобы омлет быстрее прихватился со всех сторон.",,18154
4,За минуту до полной готовности распределить тертый сыр по одной половине омлета и готовить еще 20 секунд.,,18154
5,"При помощи лопатки завернуть омлет, накрыв сырную половинку другой. Выключить огонь и оставить готовиться еще секунд на 30.",,18154
1,"На растительном масле обжарить измельченный лук до прозрачности, затем добавить мелко нарезанную курицу, посолить и жарить несколько минут, до готовности курицы.",https://s1.eda.ru/StaticContent/Photos/120213182322/180620103316/p_O.jpg,124983
2,"Добавить рис, хорошо перемешать, разбивая комочки, затем добавить горошек, кетчуп и соевый соус, перемешать и снять с огня.",https://s1.eda.ru/StaticContent/Photos/120213182322/180620103317/p_O.jpg,124983
3,"Слегка взбить два яйца со столовой ложкой сливок и щепоткой соли. Вылить яйца на разогретый вок или глубокую сковородку. Пока яйца не схватились, помешать их лопаткой или палочками, как это делают в Японии, чтобы придать омлету воздушную текстуру.",https://s1.eda.ru/StaticContent/Photos/120213182322/180620103318/p_O.jpg,124983
4,"Когда внизу омлет уже приготовился, а на поверхности еще остается сыроватым, выключить огонь и выложить на омлет половину жареного риса. Сложить края омлета на рис как бы заворачивая начинку в омлет. Аккуратно переложить омлет с рисом на тарелку, перевернув сковороду.  Подавать с кетчупом, украсив петрушкой.",https://s1.eda.ru/StaticContent/Photos/120213182322/180620103319/p_O.jpg,124983
1,"Нарезать бекон мелкими кубиками, точно так же поступить с репчатым луком.",https://s1.eda.ru/StaticContent/Photos/110816122017/170315172138/p_O.png,33818
2,"Кубиками покрупнее нарезать стебель и корень сельдерея, морковь, картошку и репу. Все корнеплоды надо, разумеется, очистить от кожицы.",https://s1.eda.ru/StaticContent/Photos/110816122017/170315172140/p_O.png,33818
3,"На оливковом масле обжарить бекон до золотистого цвета, после чего отправить к нему лук, кусочки моркови и стебля сельдерея и жарить, помеши­вая, три-четыре минуты.",https://s1.eda.ru/StaticContent/Photos/110816122017/170315172141/p_O.png,33818
4,"Добавить остальные корнеплоды, перемешать и жарить еще две-три минуты, чтобы овощи пропитались ароматами бекона и друг друга.",https://s1.eda.ru/StaticContent/Photos/110816122017/1703151721410/p_O.png,33818
5,"Залить обжаренные овощи 3 л воды (можно чуть больше — часть бульона хорошо отлить потом, чтобы использовать в соусе для следующего блюда), заправить солью, лавровым листом и перцем и варить примерно пятнадцать минут.",https://s1.eda.ru/StaticContent/Photos/110816122017/170315172142/p_O.png,33818
6,"Снять суп с огня, заправить по вкусу петрушкой (но можно и не заправлять, у супа и так богатый овощной вкус).",https://s1.eda.ru/StaticContent/Photos/110816122017/1703151721420/p_O.png,33818
7,Разлить суп из корнеплодов по тарелкам и посыпать крупно натертым пармезаном.,https://s1.eda.ru/StaticContent/Photos/110816122017/170315172143/p_O.png,33818
1,Нарезать индейку на небольшие кусочки и положить ее мариноваться в оливковом масле с соевым соусом.,,35274
