step_id,description,imageUrl,recipe_id
1,"Вскрыть две банки красной фасоли в собственном соку, слить сок и промыть фасоль холодной водой. Желающие использовать не баночную, а самостоятельно сваренную фасоль должны задуматься о приготовлении этого салата еще с вечера. Сначала замочить бобы на ночь, а потом варить их на медленном огне до готовности.",https://s1.eda.ru/StaticContent/Photos/110810174633/170313204814/p_O.png,16922
2,"Готовую фасоль смешать с мелко нарубленным красным луком, зеленью, например, рукколы (которую для удобства поедания нужно предварительно изорвать руками), давленым чесноком, оливковым маслом, лимонным соком и творожным сыром.",https://s1.eda.ru/StaticContent/Photos/110810174633/170313204815/p_O.png,16922
3,"Посолить, поперчить, дать продуктам две минуты притереться друг к другу и подавать к столу вместе с бокалом Nobile di Montepulciano, если вино осталось с вечера.",https://s1.eda.ru/StaticContent/Photos/110810174633/1703132048150/p_O.png,16922
1,"В широкую миску выложить творог, добавить яйцо, сахар и муку и вилкой смешать до однородной консистенции. Если масса получилась слишком липкой, добавить еще муки, но не больше половины столовой ложки.",https://s1.eda.ru/StaticContent/Photos/140219152153/140219202302/p_O.jpg,21975
2,Посыпать стол небольшим количеством муки и выложить творожную массу. Разделить на две равные части и из каждой скатать колбаски одинаковой толщины.,https://s1.eda.ru/StaticContent/Photos/140219152153/1402192023020/p_O.jpg,21975
3,Острым ножом нарезать колбаски на небольшие одинаковые кусочки. При желании можно слегка приплюснуть затем каждый кусочек и придать ему округлую форму.,https://s1.eda.ru/StaticContent/Photos/140219152153/140219202303/p_O.jpg,21975
4,"В небольшой кастрюле довести до кипения воду. Аккуратно один за другим опустить вареники в кипящую воду. Варить, слегка помешивая шумовкой, пока все вареники не всплывут на поверхность, плюс еще минуту.",https://s1.eda.ru/StaticContent/Photos/140219152153/140219202304/p_O.jpg,21975
5,"Готовые вареники выложить из кастрюли на тарелки и полить вареньем, например абрикосовым. Подавать их можно горячими или теплыми.",https://s1.eda.ru/StaticContent/Photos/140219152153/140219202305/p_O.jpg,21975
1,Поджарить тонкие ломтики бекона до золотистой корочки.,,17380
2,"Подогреть хлеб и одну половину сэндвича намазать майонезом (можно приготовить самостоятельно), на вторую положить сыр, ломтики помидоров, бекон и латук.",,17380
3,"Тем временем на сливочном масле поджарить небольшую глазунью — такую, чтобы желток был полуготовым.",,17380
4,"Выложить глазунью на латук, закрыть другой половинкой сэндвича и подавать.",,17380
1,"Очистить авокадо от кожуры, растолочь в миске до консистенции каши.",,47806
2,"Наполнить кастрюлю водой и поставить ее нагреваться. В это же время в отдельную емкость аккуратно разбить одно яйцо. В кастрюлю с водой обязательно добавить столовую ложку уксуса и тщательно перемешать воду. Теперь необходимо создать с помощью ложки или кулинарной лопатки воронку, раскручивая воду. Как только получится воронка, резко перелить желток и белок в кастрюлю. Если вы все сделали правильно, то белок должен будет обернуть яичный желток и вам останется лишь варить яйцо в горячей, но не кипящей воде около 4–5 минут. Аккуратно достать уже готовое яйцо пашот из кастрюли и дать ему немного обсохнуть. Лишние части белка можно удалить с помощью кулинарных ножниц.",,47806
3,"Поджарить  хлеб в тостере и выложить на него растолченное авокадо, сверху положить яйцо пашот.",,47806
4,Можно посолить/поперчить по вкусу.,,47806
1,"Обжарить тортильи на масле в сковороде, положить на бумажное полотенце.",,93826
2,"Прогреть в сковороде фасоль, кукурузу, мелко нарезанный помидор и моцареллу.",,93826
3,"Посыпать чили, готовить до загустения.",,93826
4,Вмешать порубленную зелень.,,93826
5,"На 1 лепешку выложить смесь, накрыть второй сверху и прижать, чтобы сыр скрепил края.",,93826
6,Подавать с ломтиком авокадо и гуакамоле.,,93826
1,Очистить редьку и морковь при помощи овощечистки.,https://s1.eda.ru/StaticContent/Photos/d/211124175024/p_O.jpg,27040
2,Натереть морковь на терке для корейской моркови или на обычной крупной терке.,https://s1.eda.ru/StaticContent/Photos/d/211123232448/p_O.jpg,27040
3,На той же терке натереть редьку.,https://s1.eda.ru/StaticContent/Photos/d/2111232324480/p_O.jpg,27040
4,Смешать редьку с морковью и добавить сметану.,https://s1.eda.ru/StaticContent/Photos/d/2111232324481/p_O.jpg,27040
5,Посолить по вкусу и хорошо перемешать.,https://s1.eda.ru/StaticContent/Photos/d/2111232324482/p_O.jpg,27040
1,Нарезать моцареллу кубиками.,,24403
2,Порезать помидорки черри на половинки.,,24403
3,Добавить рукколу.,,24403
4,Тщательно перемешать.,,24403
5,Добавить бальзамический уксус и оливкое масло.,,24403
6,Тщательно перемешать.,,24403
7,Оставить на 10 минут.,,24403
1,"Положите весь творог в кастрюльку и разомните его вилкой так, чтобы в нем не осталось крупных комков. Разбейте в него яйца, всыпьте сахар и тщательно все перемешайте. Лучше не использовать слишком сухой или слишком влажный творог, иначе сырники будут разваливаться в процессе приготовления.",https://s1.eda.ru/StaticContent/Photos/110811142241/170314165129/p_O.png,18506
2,"Всыпьте в творог 5 столовых ложек (с горкой) муки и тщательно перемешайте. Можно добавить немного больше муки, сырники получатся тогда более плотными. Или муки можно добавить чуть меньше, и тогда сырники будут нежнее. В итоге у вас должна получиться однородная масса, из которой можно будет лепить сырники. ",https://s1.eda.ru/StaticContent/Photos/110811142241/1703141651290/p_O.png,18506
3,Поставьте сковороду на средний огонь и налейте в нее подсолнечное масло.,https://s1.eda.ru/StaticContent/Photos/110811142241/170314165130/p_O.png,18506
4,"Насыпьте на тарелку немного муки. Слепите несколько небольших шариков из получившейся творожной массы и положите их на тарелку. Лучше лепить разом 4–5 шариков — столько, сколько поместится одновременно на сковороду. Затем по очереди обкатывайте творожные шарики в муке, плющите их в небольшие лепешки (они не должны быть слишком тонкие) и выкладывайте на сковороду.",https://s1.eda.ru/StaticContent/Photos/110811142241/1703141651300/p_O.png,18506
5,Обжаривайте сырники 1–2 минуты до появления золотистой корочки. Затем переверните их на другую сторону и также обжарьте до золотистого состояния.,https://s1.eda.ru/StaticContent/Photos/110811142241/170314165131/p_O.png,18506
6,"Повторяйте, пока творог не закончится.",https://s1.eda.ru/StaticContent/Photos/110811142241/1703141651310/p_O.png,18506
1,"Смешать яйца с солью, молотым мускатным орехом и паприкой.",https://s1.eda.ru/StaticContent/Photos/150317164033/150323191640/p_O.jpg,17602
2,"Разобрать брокколи на соцветия, перец очистить от кожицы и нарезать тонкой соломкой. Лук нарезать тонкими полукольцами.",https://s1.eda.ru/StaticContent/Photos/150317164033/150323191641/p_O.jpg,17602
3,"Чеснок и петрушку мелко нарубить, смешать их с соком лимона и оливковым маслом.",https://s1.eda.ru/StaticContent/Photos/150317164033/150323191825/p_O.jpg,17602
4,"Нарезанный лук обжарить на сливочном масле до мягкости, добавить брокколи, обжаривать минуту, после чего отправить туда же перец, жарить еще минуту, добавить щепотку листьев тимьяна, через минуту петрушку с чесноком в лимонном соке и масле, а через тридцать секунд залить яйцами. ",https://s1.eda.ru/StaticContent/Photos/150317164033/150323191827/p_O.jpg,17602
5,"Когда яйца начнут застывать, отправить сковороду в разогретую до 180 градусов духовку на семь-десять минут. Подавать, посолив, поперчив и посыпав листиками тимьяна.",https://s1.eda.ru/StaticContent/Photos/150317164033/150323191828/p_O.jpg,17602
1,"Порезать овощи крупно, салат порвать на  куски.",https://s1.eda.ru/StaticContent/Photos/110811170903/170314185702/p_O.png,21742
2,"Для креветок: Довести до кипения  сильно соленую воду с красным  и черным перцем, оливковым маслом и  половинкой лимона ( сок предварительно выжать в воду).",https://s1.eda.ru/StaticContent/Photos/110811170903/1703141857020/p_O.png,21742
3,Добавить креветки. После кипения варить 5 минут.,https://s1.eda.ru/StaticContent/Photos/110811170903/170314185703/p_O.png,21742
4,Очистить креветки от панциря.,https://s1.eda.ru/StaticContent/Photos/110811170903/1703141857030/p_O.png,21742
5,Смешать овощи  и креветки.,https://s1.eda.ru/StaticContent/Photos/110811170903/170314185704/p_O.png,21742
6,Посыпать кунжутными семечками и заправить майонезом.,https://s1.eda.ru/StaticContent/Photos/110811170903/1703141857040/p_O.png,21742
1,"Огурцы тщательно очистить от кожи и нарезать крупными полукруглыми ломтиками. Сложить в глубокий салатник или широкую миску, в которой будет удобно смешивать.",https://s1.eda.ru/StaticContent/Photos/130713154821/190725203059/p_O.jpg,30893
2,"Помидоры нарезать крупными дольками. Добавить в салатник к огурцам и перемешать. Мешать при этом греческий салат лучше всего руками, подливая на каждом этапе понемногу оливкового масла.",https://s1.eda.ru/StaticContent/Photos/130713154821/190725203100/p_O.jpg,30893
3,Сладкий зеленый перец очистить от семян и перепонок и нарезать крупными кубиками. Добавить в салатник. Перемешать с другими овощами.,https://s1.eda.ru/StaticContent/Photos/130713154821/190725203101/p_O.jpg,30893
4,"Красный лук нарезать тонкими полукольцами, а затем руками разделить на тонкие лепестки. Переложить к остальным овощам, снова все перемешать.",https://s1.eda.ru/StaticContent/Photos/130713154821/190725203102/p_O.jpg,30893
5,"Добавить в салатник маслины без косточек (можно купить уже избавленные от косточек маслины, а можно очистить их самостоятельно, раздавив плоской стороной ножа каждую маслину и вынув косточку).",https://s1.eda.ru/StaticContent/Photos/130713154821/190725203103/p_O.jpg,30893
6,"Твердую фету нарезать острым ножом на прямоугольные ломтики толщиной в 1 см. Чтобы сыр не прилипал к лезвию, нож можно предварительно окунуть в теплую воду.",https://s1.eda.ru/StaticContent/Photos/130713154821/190725203104/p_O.jpg,30893
7,Еще раз перемешать овощи в салатнике и разложить по тарелкам. Сверху на каждую порцию выложить по 2 ломтика феты. Щедро полить оливковым маслом.,https://s1.eda.ru/StaticContent/Photos/130713154821/190725203105/p_O.jpg,30893
8,"Слегка посолить салат и посыпать сушеным орегано. Сверху еще раз сбрызнуть оливковым маслом и подавать немедленно, пока овощи не пустили сок.",https://s1.eda.ru/StaticContent/Photos/130713154821/190725203106/p_O.jpg,30893
1,"Нут замочить на ночь (или на 4–6 часов). После слить воду, отварить до готовности в свежей чуть подсоленной воде 60–90 минут. Аккуратно. Не переварите.",https://s1.eda.ru/StaticContent/Photos/110812141030/170314191307/p_O.png,22649
2,"Баклажаны нарезать на крупные кубики, обжарить на оливковом масле со всех сторон до румяной корочки, посолить и тушить до мягкости/готовности. Остудить.",https://s1.eda.ru/StaticContent/Photos/110812141030/1703141913070/p_O.png,22649
3,"Кинзу, петрушку и чеснок измельчить, добавить паприку, зиру, оливковое масло, уксус и лимонный сок.",https://s1.eda.ru/StaticContent/Photos/110812141030/170314191308/p_O.png,22649
4,"Нут, баклажаны и заправку смешать, посолить. Дать настояться в холодильнике часа 2.",https://s1.eda.ru/StaticContent/Photos/110812141030/170314191309/p_O.png,22649
1,"Растопить в глубокой сковороде сливочное масло (80 г) и обжарить на нем мелко нарубленный лук. Лук должен стать совершенно мягким и полупрозрачным. Всыпать рис и обжаривать его несколько минут, постоянно помешивая. Добавить мелко нарубленный чеснок, перемешать, потомить вместе с рисом, маслом и луком; как только чеснок практически растворится в массе риса и лука и начнет издавать свой характернейший из запахов, влить в сковороду сухой херес, перемешать с рисом и овощами и, убрав до минимума огонь, выпаривать алкоголь, постоянно помешивая. ",https://s1.eda.ru/StaticContent/Photos/170210144850/170306153843/p_O.jpg,15911
2,"Как только о присутствии хереса станет напоминать исключительно его аромат, влить в сковороду треть бульона, перемешать содержимое сковороды, чтобы бульон проник во все самые тайные норки, и варить рис на медленном огне, доливая бульон по мере его выкипания. ",https://s1.eda.ru/StaticContent/Photos/170210144850/170306153844/p_O.jpg,15911
3,На оставшемся сливочном масле обжарить мелко нарезанные и очищенные от семечек и прочих внутренних излишеств перцы. Перцы должны стать мягкими и начать пахнуть жареным. ,https://s1.eda.ru/StaticContent/Photos/170210144850/170306153845/p_O.jpg,15911
4,"Всыпать перцы в сковороду с полуготовым ризотто, посолить, поперчить, перемешать, долить бульон и продолжать ту же канитель с варкой — помешивать, доливать бульон.",https://s1.eda.ru/StaticContent/Photos/170210144850/170306153846/p_O.jpg,15911
5,"Когда рис будет практически готов, вмешать в него сливки. Выключить огонь и еще примерно минуту помешивать содержимое сковороды, чтобы добиться кремовой консистенции ризотто. ",https://s1.eda.ru/StaticContent/Photos/170210144850/170306153847/p_O.jpg,15911
6,"Подавать, посыпав листочками тимьяна.",https://s1.eda.ru/StaticContent/Photos/170210144850/170306153849/p_O.jpg,15911
1,"Помидоры среднего размера нарезать кольцами толщиной около сантиметра. Разогреть сковороду, влить чуть-чуть оливкового масла и обжарить ломтики томатов до появления корочки, а затем снять с огня.",https://s1.eda.ru/StaticContent/Photos/120131082227/170417073330/p_O.jpg,31055
2,"Смешать натуральный йогурт с 50 мл оливкового масла. Зубчик чеснока раздавить ножом, разобрать на волокна и мелко нарезать. Добавить нарубленный чеснок к йогурту с маслом, посолить и поперчить по вкусу.",https://s1.eda.ru/StaticContent/Photos/120131082227/170417073331/p_O.jpg,31055
3,"Заправить получившимся соусом смесь салатных листьев, украсить кольцами обжаренных томатов и подавать, когда они чуть остынут — или еще горячими, это уже дело вкуса.",https://s1.eda.ru/StaticContent/Photos/120131082227/1704170733310/p_O.jpg,31055
1,"Кабачки очистить от семечек и поролоновых внутренностей (если вы используете цукини, эту хирургическую операцию можно не проводить), нарезать крупными кусками (3–4 см). Лук мелко нарубить. А помидоры нарезать примерно вдвое меньшими кусочками по срав­нению с кабачками.",,15671
2,Разогреть в глубоком сотейнике смесь растительного и оливкового масла и обжарить лук до мягкости.,,15671
3,"Всыпать в сотейник с луком кабачки и, помешивая, дождаться того момента, когда они пустят сок. Тогда добавить к ним в компанию помидоры, перемешать. Тушить на быстром огне минуты 2–3. Уменьшить огонь, всыпать в сотейник сахар, добавить душистый перец и лавровый лист. Тушить еще 3 минуты. Потом посолить. Перемешать, стараясь не превратить содержимое сотейника в кабачковую икру или кашу. Тушить еще 2 минуты.",,15671
4,"Тем временем мелко нарубить петрушку, очистить чеснок. Заправить рагу давленым чесноком и петрушкой, приправить молотым перцем, перемешать и сразу снять с огня. Подавать с холодной жирной сметаной. Лавровый лист и душистый перец, чтобы потом не попадали в тарелку, можно класть в рагу, запаковав в мешочек из марли.",,15671
1,"Печень промыть. Если есть время вымочить в молоке минут 20, будет еще нежнее. Если времени нет, то можно и не вымачивать. Обрезать прожилки. Порезать на небольшие кусочки.",https://s1.eda.ru/StaticContent/Photos/130822102925/190819151712/p_O.jpg,31593
2,Обжарить до золотистого цвета мелко порубленный репчатый лук на сливочном масле.,https://s1.eda.ru/StaticContent/Photos/130822102925/190819151713/p_O.jpg,31593
3,"Добавить печень. Обжаривать минут 5–7, пока не пропадет красный цвет. Посолить, поперчить.",https://s1.eda.ru/StaticContent/Photos/130822102925/190819151714/p_O.jpg,31593
4,Залить сметаной. Тушить на среднем огне минут 10.,https://s1.eda.ru/StaticContent/Photos/130829212936/190819151715/p_O.jpg,31593
1,Куриные бедра нарубить на куски помельче и обжарить в глубокой сковороде на оливковом масле до полуготовности.,https://s1.eda.ru/StaticContent/Photos/170210144850/170306161522/p_O.jpg,17276
2,"Лук мелко нарубить и обжарить вместе с курицей. Когда лук станет мягким, добавить мелко нарезанный чеснок и рис. Жарить все это в течение двух-трех минут. После чего всыпать в сковороду мелко нарезанные перец и помидоры. Перемешать и тушить еще минуту-другую, помешивая, чтобы содержимое сковороды не подгорало.",https://s1.eda.ru/StaticContent/Photos/170210144850/170306161523/p_O.jpg,17276
